{
  "id": "arxiv",
  "displayName": "arXiv",
  "provider": "omnifs_provider_arxiv.wasm",
  "defaultMount": "arxiv",
  "capabilities": [
    {
      "kind": "domain",
      "value": "export.arxiv.org",
      "why": "Fetch arXiv API metadata and paper resources from arXiv-owned domains."
    },
    {
      "kind": "domain",
      "value": "arxiv.org",
      "why": "Fetch arXiv API metadata and paper resources from arXiv-owned domains."
    },
    {
      "kind": "memoryMb",
      "value": 64,
      "why": "Bound provider memory while leaving enough room for Atom feeds and paper metadata."
    }
  ]
}
