{
  "id": "kubernetes",
  "displayName": "Kubernetes",
  "provider": "omnifs_provider_kubernetes.wasm",
  "defaultMount": "k8s",
  "capabilities": [
    {
      "kind": "unixSocket",
      "value": "kubectl proxy socket",
      "dynamic": true,
      "why": "Talk to the Kubernetes API server through a local `kubectl proxy --unix-socket` endpoint. kubectl terminates TLS and injects the active-context credentials, so the provider issues plain HTTP over the socket and never handles a token."
    },
    {
      "kind": "memoryMb",
      "value": 256,
      "why": "Leave room for API discovery across all groups plus large list and manifest payloads."
    }
  ],
  "configSchema": {
    "type": "object",
    "required": ["endpoint"],
    "additionalProperties": false,
    "properties": {
      "endpoint": {
        "type": "string",
        "default": "unix:///run/omnifs/k8s.sock",
        "description": "Kubernetes API endpoint. Use a `unix://` socket served by `kubectl proxy --unix-socket`; kubectl owns TLS and cluster credentials, and the provider issues plain HTTP over the socket."
      },
      "hide_empty_types": {
        "type": "boolean",
        "default": false,
        "description": "When true, listing a namespace or `/cluster` shows only resource types that currently have at least one instance, instead of the full discovery catalog. Costs one batched limit=1 probe per type per listing; empty types remain directly navigable."
      }
    }
  }
}
